{
  "status": "DESIGN CONFIGURATION - NO MODEL OR RUNTIME VALIDATION",
  "namespace_version": "FC01.Vision.v3",
  "opcua_endpoint": "opc.tcp://192.168.10.10:4840",
  "security_policy": "Basic256Sha256/SignAndEncrypt",
  "anonymous_access": false,
  "expected_bottles": 2,
  "request_timeout_ms": 1000,
  "heartbeat_timeout_ms": 1000,
  "signal_count": 47,
  "node_map": "../plc_ai_node_map.csv",
  "result_atomicity": "write complete payload including result ID/session/model identity, then set RESULT_VALID last; hold immutable until exact ACK",
  "ack_semantics": "Transport acknowledgement is independent of quality acceptance. PLC writes the exact current RESULT_ID for every observed complete publication, including rejected/orphaned data, so NVIDIA clears RESULT_VALID; unchanged prior ACK is ignored while a newer result waits",
  "session_rearm": "On startup/restart READY remains low. With VISION_ENABLE low, atomically snapshot VISION_SESSION_EPOCH, INSPECTION_ID, RESULT_ACK_ID and PLC_HEARTBEAT into reset(); only then assert READY. A serially advanced nonzero session must use the same disabled synchronization. The seeded same-session counters prevent replay after a cold edge restart",
  "certificate_policy": "Site CA, named client identity, least-privilege namespace; provisioning open",
  "durable_event_sink": "Append/flush/fsync JSONL available; rotation and site retention/export policy remain open",
  "model_bundle": null,
  "nodes": {
    "VISION_ENABLE": "ns=3;s=FC01.Vision.VISION_ENABLE",
    "INSPECTION_TRIGGER": "ns=3;s=FC01.Vision.INSPECTION_TRIGGER",
    "INSPECTION_ID": "ns=3;s=FC01.Vision.INSPECTION_ID",
    "RECIPE_ID": "ns=3;s=FC01.Vision.RECIPE_ID",
    "EXPECTED_BOTTLES": "ns=3;s=FC01.Vision.EXPECTED_BOTTLES",
    "TARGET_FILL_LEVEL": "ns=3;s=FC01.Vision.TARGET_FILL_LEVEL",
    "PLC_HEARTBEAT": "ns=3;s=FC01.Vision.PLC_HEARTBEAT",
    "VISION_READY": "ns=3;s=FC01.Vision.VISION_READY",
    "VISION_BUSY": "ns=3;s=FC01.Vision.VISION_BUSY",
    "RESULT_VALID": "ns=3;s=FC01.Vision.RESULT_VALID",
    "RESULT_ID": "ns=3;s=FC01.Vision.RESULT_ID",
    "BOTTLE_1_PASS": "ns=3;s=FC01.Vision.BOTTLE_1_PASS",
    "BOTTLE_2_PASS": "ns=3;s=FC01.Vision.BOTTLE_2_PASS",
    "FILL_1_STATUS": "ns=3;s=FC01.Vision.FILL_1_STATUS",
    "FILL_2_STATUS": "ns=3;s=FC01.Vision.FILL_2_STATUS",
    "LEAK_OR_SPILL_DETECTED": "ns=3;s=FC01.Vision.LEAK_OR_SPILL_DETECTED",
    "LOW_CONFIDENCE": "ns=3;s=FC01.Vision.LOW_CONFIDENCE",
    "VISION_WARNING": "ns=3;s=FC01.Vision.VISION_WARNING",
    "VISION_FAULT": "ns=3;s=FC01.Vision.VISION_FAULT",
    "INFERENCE_TIME": "ns=3;s=FC01.Vision.INFERENCE_TIME",
    "VISION_HEARTBEAT": "ns=3;s=FC01.Vision.VISION_HEARTBEAT",
    "VISION_RESULT_ACK_ID": "ns=3;s=FC01.Vision.VISION_RESULT_ACK_ID",
    "VISION_SESSION_EPOCH": "ns=3;s=FC01.Vision.VISION_SESSION_EPOCH",
    "VISION_RESULT_SESSION_EPOCH": "ns=3;s=FC01.Vision.VISION_RESULT_SESSION_EPOCH",
    "VISION_DIAG_REASON": "ns=3;s=FC01.Vision.VISION_DIAG_REASON",
    "VISION_MODEL_ID": "ns=3;s=FC01.Vision.VISION_MODEL_ID",
    "VISION_MODEL_SHA256": "ns=3;s=FC01.Vision.VISION_MODEL_SHA256",
    "MAINTENANCE_MODE": "ns=3;s=FC01.Vision.MAINTENANCE_MODE",
    "EXPECTED_DATASET_ID": "ns=3;s=FC01.Vision.EXPECTED_DATASET_ID",
    "EXPECTED_CALIBRATION_ID": "ns=3;s=FC01.Vision.EXPECTED_CALIBRATION_ID",
    "CAPTURE_ACK_ID": "ns=3;s=FC01.Vision.CAPTURE_ACK_ID",
    "PROCESSING_STATE": "ns=3;s=FC01.Vision.PROCESSING_STATE",
    "SERVICE_HEALTHY": "ns=3;s=FC01.Vision.SERVICE_HEALTHY",
    "CAMERA_HEALTHY": "ns=3;s=FC01.Vision.CAMERA_HEALTHY",
    "MODEL_LOADED": "ns=3;s=FC01.Vision.MODEL_LOADED",
    "MAINTENANCE_ACTIVE": "ns=3;s=FC01.Vision.MAINTENANCE_ACTIVE",
    "RESULT_DISPOSITION": "ns=3;s=FC01.Vision.RESULT_DISPOSITION",
    "REASON_BITS": "ns=3;s=FC01.Vision.REASON_BITS",
    "CONFIDENCE": "ns=3;s=FC01.Vision.CONFIDENCE",
    "DATASET_ID": "ns=3;s=FC01.Vision.DATASET_ID",
    "CALIBRATION_ID": "ns=3;s=FC01.Vision.CALIBRATION_ID",
    "CAPTURE_TIMESTAMP_UTC_MS": "ns=3;s=FC01.Vision.CAPTURE_TIMESTAMP_UTC_MS",
    "INFERENCE_TIMESTAMP_UTC_MS": "ns=3;s=FC01.Vision.INFERENCE_TIMESTAMP_UTC_MS",
    "PUBLICATION_TIMESTAMP_UTC_MS": "ns=3;s=FC01.Vision.PUBLICATION_TIMESTAMP_UTC_MS",
    "PROCESSING_TIME_MS": "ns=3;s=FC01.Vision.PROCESSING_TIME_MS",
    "DIAGNOSTIC_CODE": "ns=3;s=FC01.Vision.DIAGNOSTIC_CODE",
    "QUEUE_DEPTH": "ns=3;s=FC01.Vision.QUEUE_DEPTH"
  }
}
